question,original_answers,sentences,sentence_scores,passage_score,has_hallucination,method_used,threshold_used,enhanced_answer,enhanced_sentence_scores,enhanced_passage_score,improvement,category,model
How does hypertension affect the cardiovascular system?,"['**Hypertension affects the cardiovascular system in several ways:**\n\n**1. Increased cardiac workload:**\n\n* High blood pressure increases the workload on the heart, as it must work harder to pump blood through narrowed blood vessels.\n* This can lead to heart enlargement and impaired function.\n\n\n**2. Thickening of blood vessels:**\n\n* Arteries become thickened and rigid due to increased blood pressure, making blood flow narrower.\n* This narrowing reduces blood flow to vital organs and tissues.\n\n\n**3. Impaired blood flow:**\n\n* Restricted blood flow can lead to tissue hypoxia and damage, including heart attack, stroke, kidney failure, and peripheral artery disease.\n\n\n**4. Left ventricular hypertrophy:**\n\n* Hypertension can cause the left ventricle (heart muscle) to thicken abnormally, increasing the risk of heart failure.\n\n\n**5. Cardiovascular hypertrophy:**\n\n* The entire cardiovascular system undergoes structural changes in response to high blood pressure, leading to increased muscle mass and stiffness.\n\n\n**6. Increased risk of cardiovascular events:**\n\n* Hypertension significantly raises the risk of heart attack, stroke, heart failure, and other cardiovascular events.\n\n\n**7. Impaired endothelial function:**\n\n* High blood pressure damages the endothelial cells lining blood vessels, leading to increased inflammation and narrowing.\n\n\n**8. Activation of clotting pathways:**\n\n* Hypertension activates clotting pathways, increasing the risk of blood clots.\n\n\n**9. Fluid retention:**\n\n* Elevated blood pressure can lead to fluid retention in the body, causing swelling and further increasing blood volume.\n\n\n**10. Increased sympathetic activity:**\n\n* Hypertension triggers increased activation of the sympathetic nervous system, which can lead to increased heart rate, blood pressure, and muscle tension.', '**Hypertension (high blood pressure) affects the cardiovascular system in multiple ways:**\n\n**1. Increased workload on the heart:**\n\n* High blood pressure forces the heart to work harder to pump blood throughout the body.\n* This increased workload can lead to heart enlargement and impaired heart function.\n\n\n**2. Thickening of blood vessel walls:**\n\n* The combination of increased blood pressure and impaired blood flow can cause thickening of the blood vessel walls.\n* This process can narrow blood vessels and further impede blood flow.\n\n\n**3. Impaired blood flow:**\n\n* Hypertension can damage blood vessels throughout the body, leading to reduced blood flow to vital organs such as the brain, kidneys, and extremities.\n* Reduced blood flow can cause various symptoms and complications, including heart attack, stroke, kidney failure, and limb amputation.\n\n\n**4. Increased risk of heart attack and stroke:**\n\n* High blood pressure is a major risk factor for cardiovascular events such as heart attack and stroke.\n* The increased blood flow resistance can make it easier for plaque to rupture and block blood flow, leading to these events.\n\n\n**5. Left ventricular hypertrophy:**\n\n* Hypertension can cause the left ventricle (the main pumping chamber of the heart) to enlarge and thicken in response to the increased workload.\n* This condition is known as left ventricular hypertrophy and can lead to heart failure.\n\n\n**6. Peripheral vascular disease:**\n\n* Hypertension can damage blood vessels in the limbs, leading to peripheral vascular disease.\n* This condition can cause pain, swelling, and diminished mobility.\n\n\n**7. Cardiopulmonary complications:**\n\n* High blood pressure can worsen existing heart conditions, such as heart failure and atrial fibrillation.\n* It can also increase the risk of respiratory complications like sleep apnea and sudden cardiac death syndrome.\n\n\n**8. Increased inflammation:**\n\n* Hypertension is associated with increased inflammation in the blood vessels, which can contribute to the progression of cardiovascular disease.', '**Hypertension (high blood pressure) affects the cardiovascular system in several ways:**\n\n**1. Increased workload on the heart:**\n\n- High blood pressure can increase the workload on the heart as it has to pump blood against greater resistance.\n- This increased workload can lead to cardiac enlargement and increased risk of heart failure.\n\n\n**2. Thickening of blood vessels:**\n\n- Hypertension can cause the blood vessels to thicken and become less flexible.\n- This narrowing can reduce blood flow to vital organs and tissues, leading to impaired function and damage.\n\n\n**3. Damage to blood vessels:**\n\n- High blood pressure can damage blood vessels throughout the body, leading to:\n    - Aneurysm formation\n    - Plaque buildup\n    - Increased risk of stroke and heart attack\n\n\n**4. Impaired blood flow:**\n\n- Reduced blood flow to the organs can lead to:\n    - Kidney damage\n    - Heart attack\n    - Stroke\n    - Gangrene\n\n\n**5. Increased risk of cardiac events:**\n\n- Hypertension is a major risk factor for:\n    - Heart attack\n    - Stroke\n    - Peripheral artery disease\n\n\n**6. Heart enlargement:**\n\n- Chronic high blood pressure can cause the heart muscle to enlarge, leading to:\n    - Reduced heart function\n    - Increased risk of heart failure\n\n\n**7. Arrhythmias:**\n\n- Hypertension can increase the risk of abnormal heartbeats (arrhythmias).\n\n\n**8. Reduced elasticity:**\n\n- High blood pressure can reduce the elasticity of blood vessels, making them less able to adapt to changes in blood flow.\n\n\n**9. Increased inflammation:**\n\n- Hypertension can promote inflammation in the blood vessels, contributing to their damage.\n\n\n**10. Hormonal changes:**\n\n- High blood pressure can affect hormone balance, contributing to cardiovascular complications.', '**Hypertension affects the cardiovascular system in several ways:**\n\n**1. Increased workload for the heart:**\n\n* High blood pressure forces the heart to work harder to pump blood against resistance.\n* This increased workload can lead to heart enlargement and increased risk of heart failure.\n\n\n**2. Thickening of blood vessels:**\n\n* Hypertension causes the blood vessels to become stiffer and less flexible.\n* This narrowing of the vessels reduces blood flow to vital organs and tissues.\n\n\n**3. Impaired blood flow:**\n\n* Reduced blood flow to the heart, brain, kidneys, and other organs can lead to reduced function and damage.\n* It can also cause peripheral artery disease, leading to pain, numbness, and tissue damage.\n\n\n**4. Increased risk of heart attack and stroke:**\n\n* The narrowing of blood vessels can restrict blood flow to the heart, increasing the risk of heart attack.\n* Similarly, it can reduce blood flow to the brain, increasing the risk of stroke.\n\n\n**5. Heart rhythm disturbances:**\n\n* Hypertension can also disrupt the electrical conduction system of the heart, leading to irregular heartbeats (arrhythmias).\n\n\n**6. Increased risk of heart failure:**\n\n* Chronic high blood pressure can cause heart muscle damage and enlargement, increasing the risk of heart failure.\n\n\n**7. Impaired kidney function:**\n\n* Hypertension can damage the kidneys by causing fluid retention, protein loss, and decreased urine output.\n\n\n**8. Increased inflammation:**\n\n* High blood pressure is associated with increased inflammation in the blood vessels, which can contribute to other cardiovascular problems.', ""**Hypertension (high blood pressure) affects the cardiovascular system in multiple ways:**\n\n**1. Vascular System:**\n\n* Increased blood pressure can narrow blood vessels, restricting blood flow to vital organs.\n* Narrowed blood vessels can impede oxygen and nutrient delivery, leading to tissue damage.\n* A build-up of plaque in the arteries can increase the risk of heart attack, stroke, and other cardiovascular events.\n\n\n**2. Heart Function:**\n\n* High blood pressure can strain the heart, increasing the workload of the heart muscle.\n* It can also lead to heart enlargement and impaired heart function.\n* Hypertension is a major risk factor for heart failure.\n\n\n**3. Blood Flow Regulation:**\n\n* The body's ability to regulate blood pressure and blood flow is impaired.\n* This can lead to inadequate oxygen supply to tissues and organs, resulting in impaired function and damage.\n\n\n**4. Cardiac Output:**\n\n* Increased blood pressure can decrease cardiac output (the amount of blood pumped by the heart per minute).\n* Reduced cardiac output can lead to tissue hypoxia and organ damage.\n\n\n**5. Atherosclerosis:**\n\n* Hypertension can accelerate the process of atherosclerosis (plaque buildup in arteries).\n* This increases the risk of cardiovascular events such as heart attack, stroke, and peripheral artery disease.\n\n\n**6. Microvascular Damage:**\n\n* High blood pressure can damage small blood vessels throughout the body, leading to impaired circulation and tissue damage.\n* This can cause symptoms such as erectile dysfunction, kidney problems, and skin discoloration.\n\n\n**7. Increased Risk of Cardiovascular Events:**\n\n* Hypertension is associated with an increased risk of heart attack, stroke, heart failure, and other cardiovascular events.\n* The risk of these events is dose-dependent, meaning the higher the blood pressure, the greater the risk.""]","['**Hypertension affects the cardiovascular system in several ways:**\n\n**1.', 'Increased cardiac workload:**\n\n* High blood pressure increases the workload on the heart, as it must work harder to pump blood through narrowed blood vessels.', '*', 'This can lead to heart enlargement and impaired function.', '**2.', 'Thickening of blood vessels:**\n\n*', 'Arteries become thickened and rigid due to increased blood pressure, making blood flow narrower.', '*', 'This narrowing reduces blood flow to vital organs and tissues.', '**3. Impaired blood flow:**\n\n* Restricted blood flow can lead to tissue hypoxia and damage, including heart attack, stroke, kidney failure, and peripheral artery disease.', '**4.', 'Left ventricular hypertrophy:**\n\n* Hypertension can cause the left ventricle (heart muscle) to thicken abnormally, increasing the risk of heart failure.', '**5.', 'Cardiovascular hypertrophy:**\n\n*', 'The entire cardiovascular system undergoes structural changes in response to high blood pressure, leading to increased muscle mass and stiffness.', '**6.', 'Increased risk of cardiovascular events:**\n\n* Hypertension significantly raises the risk of heart attack, stroke, heart failure, and other cardiovascular events.', '**7. Impaired endothelial function:**\n\n* High blood pressure damages the endothelial cells lining blood vessels, leading to increased inflammation and narrowing.', '**8.', 'Activation of clotting pathways:**\n\n* Hypertension activates clotting pathways, increasing the risk of blood clots.', '**9.', 'Fluid retention:**\n\n*', 'Elevated blood pressure can lead to fluid retention in the body, causing swelling and further increasing blood volume.', '**10.', 'Increased sympathetic activity:**\n\n*', 'Hypertension triggers increased activation of the sympathetic nervous system, which can lead to increased heart rate, blood pressure, and muscle tension.']","[0.012074550497345626, 0.000511011963681085, 0.028036450501531363, 0.0005630551968351938, 0.3994050770998001, 0.25034759007394314, 0.1060721357280272, 0.028036450501531363, 0.003154633057420142, 0.014958350919187069, 0.1842950889840722, 0.00513444235548377, 0.170331253670156, 0.06659973599016666, 0.4436470316722989, 0.16368726454675198, 0.013484909053659067, 0.08010090235620737, 0.24744013417512178, 0.014585609431378543, 0.6055988296866417, 0.24215351045131683, 0.04302275297231972, 0.7451678570359945, 0.24587739072740078, 0.3736600549891591]",0.1726133105245166,False,nli,0.5,,,,,Medical,gemma:7b
What is the difference between Type 1 and Type 2 diabetes?,"[""**Type 1 diabetes:**\n\n* An autoimmune disease where the immune system mistakenly attacks and destroys the insulin-producing beta cells in the pancreas.\n* People with type 1 diabetes need to take insulin daily to survive. \n* Usually diagnosed in childhood or adolescence.\n\n\n**Type 2 diabetes:**\n\n* A metabolic disorder where the body doesn't make enough insulin or doesn't use insulin well.\n* Can be managed with diet, exercise, medication, or a combination of these.\n* Usually diagnosed in adulthood."", '**Type 1 diabetes:**\n\n* Autoimmune disease that destroys insulin-producing beta cells in the pancreas.\n* Requires daily insulin injections to survive.\n* Usually diagnosed in childhood or adolescence.\n\n\n**Type 2 diabetes:**\n\n* Characterized by insulin resistance and impaired insulin production.\n* Can be managed with diet, exercise, medication, or a combination of these.\n* Usually diagnosed in adulthood.', ""**Type 1 diabetes:**\n\n* Autoimmune disease that destroys insulin-producing beta cells in the pancreas.\n* Requires daily insulin injections to survive.\n* Typically diagnosed in childhood or adolescence.\n\n\n**Type 2 diabetes:**\n\n* Insulin resistance and impaired insulin production that gradually worsen over time.\n* Characterized by high blood sugar levels (hyperglycemia) due to:\n    * Cells become less responsive to insulin.\n    * The pancreas may not be able to produce enough insulin to meet the body's needs.\n* Usually diagnosed in adulthood."", '**Type 1 diabetes:**\n\n* An autoimmune disease in which the immune system mistakenly attacks and destroys insulin-producing beta cells in the pancreas.\n* Requires daily insulin injections to survive.\n* Typically diagnosed in childhood or adolescence.\n\n\n**Type 2 diabetes:**\n\n* A metabolic disorder characterized by insulin resistance and impaired insulin production.\n* The body either does not make enough insulin or does not use insulin effectively.\n* Can be managed with diet, exercise, medication, or a combination of these.', ""**Type 1 diabetes:**\n\n- An autoimmune disease where the immune system mistakenly attacks and destroys insulin-producing beta cells in the pancreas.\n- Insulin production is significantly reduced or stopped, leading to high blood sugar levels.\n- Usually diagnosed in childhood or adolescence.\n\n\n**Type 2 diabetes:**\n\n- A metabolic disorder characterized by insulin resistance and impaired insulin production.\n- The body's cells become less sensitive to insulin, leading to elevated blood sugar levels.\n- Usually develops in adulthood and is associated with factors such as excess weight, physical inactivity, and family history.""]","['**Type 1 diabetes:**\n\n*', 'An autoimmune disease where the immune system mistakenly attacks and destroys the insulin-producing beta cells in the pancreas.', '* People with type 1 diabetes need to take insulin daily to survive.', '* Usually diagnosed in childhood or adolescence.', '**Type 2 diabetes:**\n\n*', ""A metabolic disorder where the body doesn't make enough insulin or doesn't use insulin well."", '* Can be managed with diet, exercise, medication, or a combination of these.', '* Usually diagnosed in adulthood.']","[0.8351338356733322, 0.01804892555810511, 0.21144979710152256, 0.16912306046287995, 0.9834816455841064, 0.01964101759949699, 0.447506389580667, 0.924677163362503]",0.45113272936532667,False,nli,0.5,,,,,Medical,gemma:7b
What are the main functions of the liver?,"['**Main functions of the liver:**\n\n**1. Metabolism Regulation:**\n- Produces bile, essential for fat digestion\n- Detoxifies blood and removes harmful substances\n- Regulates blood sugar levels\n- Synthesizes proteins, clotting factors, and other important substances\n\n\n**2. Detoxification:**\n- Filters blood from harmful substances like drugs, alcohol, and toxins\n- Produces urine and bile, which remove these substances from the body\n\n\n**3. Storage:**\n- Stores glycogen, which can be converted to glucose when needed\n- Stores vitamins A, D, B12, and iron\n- Stores bile for reuse\n\n\n**4. Blood Regulation:**\n- Regulates blood clotting\n- Maintains blood pH and electrolyte balance\n- Produces albumin, which binds to toxins and helps to remove them from the bloodstream\n\n\n**5. Production of Bile:**\n- Bile is essential for fat digestion and absorption\n\n\n**6. Production of Important Substances:**\n- Produces urine, which is essential for hydration and waste removal\n- Produces saliva, which is essential for digestion\n- Produces tears, which are essential for vision\n\n\n**7. Production of Heat:**\n- Produces heat to maintain body temperature\n\n\n**8. Production of Cholesterol:**\n- Produces cholesterol, which is essential for hormone production and cell function', '**Main functions of the liver:**\n\n**1. Metabolism regulation:**\n* Production of bile for fat digestion\n* Storage and release of glucose as needed\n* Production of proteins, clotting factors, and enzymes\n* Detoxification of blood\n\n\n**2. Detoxification:**\n* Removal of toxins, drugs, alcohol, and bile acids from blood\n* Production of urine and sweat to eliminate waste products\n\n\n**3. Blood regulation:**\n* Production of blood clotting factors\n* Regulation of blood sugar levels\n* Storage of vitamins (A, D, B12) and minerals (iron)\n* Production of albumin and clotting factors\n\n\n**4. Bile production:**\n* Production of bile, which is essential for fat digestion and absorption\n\n\n**5. Storage:**\n* Storage of glycogen, glucose, and other nutrients\n* Release of these nutrients as needed to maintain energy balance\n\n\n**6. Production of various substances:**\n* Production of urine\n* Synthesis of bile pigments\n* Production of blood clotting factors and enzymes\n\n\n**7. Regulation of body temperature:**\n* Production of heat and regulation of body temperature\n\n\n**8. Production of biochemical signals:**\n* Production of hormones and other chemical messengers that regulate metabolism, mood, and other bodily functions', '**Main functions of the liver:**\n\n**1. Metabolic regulation:**\n- Production of bile, which aids in fat digestion\n- Detoxification of blood\n- Regulation of blood sugar levels\n- Synthesis of proteins, vitamins, and bile salts\n\n\n**2. Storage:**\n- Storage of glycogen, which can be converted into glucose when needed\n- Storage of essential minerals like iron and copper\n- Storage of vitamins A, D, B12, and K\n\n\n**3. Production:**\n- Production of blood clotting factors\n- Production of serum proteins\n- Production of bile, which helps digest fats\n- Production of urine and sweat\n\n\n**4. Detoxification:**\n- Removal of toxins from the blood\n- Metabolism of drugs and alcohol\n- Production of bile, which helps remove toxins from the body\n\n\n**5. Regulation:**\n- Regulation of blood flow\n- Regulation of body temperature\n- Regulation of hormone levels\n\n\n**6. Waste elimination:**\n- Production of urine and bile, which remove waste products from the body\n- Processing of blood clotting factors, which eliminates unnecessary ones from the bloodstream', '**Main functions of the liver:**\n\n**1. Metabolism Regulation:**\n\n* Production of bile, essential for fat digestion\n* Synthesis of glucose, proteins, and blood clotting factors\n* Detoxification of blood\n* Metabolism of drugs and hormones\n\n\n**2. Detoxification:**\n\n* Removal of toxins, waste products, and harmful substances from the bloodstream\n* Production of urine and bile, which carry these substances out of the body\n\n\n**3. Storage:**\n\n* Storage of glycogen, glucose, and other nutrients\n* Release of these nutrients into the bloodstream as needed\n\n\n**4. Blood Regulation:**\n\n* Production of clotting factors\n* Regulation of blood clotting and bleeding\n* Maintenance of blood pH and temperature\n\n\n**5. Production:**\n\n* Production of bile, which helps digest fats\n* Production of albumin, clotting factors, and other essential proteins\n* Synthesis of blood clotting factors and other clotting components\n\n\n**6. Regulation of Immune Function:**\n\n* Production of immune cells and antibodies\n* Processing and presenting antigens to the immune system\n\n\n**7. Production of Bile:**\n\n* Synthesis of bile, a greenish-brown liquid that helps break down fats in the small intestine\n\n\n**8. Synthesis of Glycogen:**\n\n* Production of glycogen, a stored form of glucose that can be used for energy when needed', '**The main functions of the liver include:**\n\n**1. Metabolism Regulation:**\n- Production of bile, which aids in fat digestion\n- Regulation of blood sugar levels\n- Synthesis of proteins, vitamins, and minerals\n- Detoxification of drugs and toxins from the bloodstream\n\n\n**2. Detoxification:**\n- Removal of harmful substances from blood, such as toxins, drugs, and metabolic waste\n- Production of urine and bile, which contain waste products\n\n\n**3. Storage:**\n- Storage of glycogen, which can be converted into glucose when needed\n- Storage of vitamins A, D, B12, and iron\n- Production of blood clotting factors and other proteins\n\n\n**4. Blood Regulation:**\n- Maintenance of blood pH and electrolyte balance\n- Regulation of blood clotting\n- Production of clotting factors\n\n\n**5. Production of Bile:**\n- Bile is essential for fat digestion and absorption\n\n\n**6. Production of Urine:**\n- The liver filters blood and produces urine, which is excreted by the kidneys\n\n\n**7. Regulation of Body Heat:**\n- The liver plays a role in regulating body temperature\n\n\n**8. Synthesis of Plasma Proteins:**\n- Production of clotting factors, albumin, and other plasma proteins']","['**Main functions of the liver:**\n\n**1.', 'Metabolism Regulation:**\n- Produces bile, essential for fat digestion\n- Detoxifies blood and removes harmful substances\n- Regulates blood sugar levels\n- Synthesizes proteins, clotting factors, and other important substances\n\n\n**2.', 'Detoxification:**\n- Filters blood from harmful substances like drugs, alcohol, and toxins\n- Produces urine and bile, which remove these substances from the body\n\n\n**3.', 'Storage:**\n- Stores glycogen, which can be converted to glucose when needed\n- Stores vitamins A, D, B12, and iron\n- Stores bile for reuse\n\n\n**4.', 'Blood Regulation:**\n- Regulates blood clotting\n- Maintains blood pH and electrolyte balance\n- Produces albumin, which binds to toxins and helps to remove them from the bloodstream\n\n\n**5.', 'Production of Bile:**\n- Bile is essential for fat digestion and absorption\n\n\n**6.', 'Production of Important Substances:**\n- Produces urine, which is essential for hydration and waste removal\n- Produces saliva, which is essential for digestion\n- Produces tears, which are essential for vision\n\n\n**7.', 'Production of Heat:**\n- Produces heat to maintain body temperature\n\n\n**8.', 'Production of Cholesterol:**\n- Produces cholesterol, which is essential for hormone production and cell function']","[0.08294287929311395, 0.006929808296263218, 0.012358709296677262, 0.35430146008729935, 0.20326499501243234, 0.07483601884450763, 0.5425108447670937, 0.41176191065460443, 0.14995327405631542]",0.20431776670092303,False,nli,0.5,,,,,Medical,gemma:7b
